<?xml version="1.0" encoding="UTF-8"?>
<!DOCTYPE style-config SYSTEM "./exportConfig_1_1.dtd">
<excel>
	<body>
		<table>
			<tr>
				<td>
					序号
				</td>
				<td>
					SID
				</td>
				<td>
					姓名
				</td>
				<td>
					所属地区
				</td>
				<td>
					所属区
				</td>
				<td>
					所属社区
				</td>
				<td>
					样本ID（前7位）
				</td>
				<td>
					血液采样日期
				</td>
				<td>
					血清冷冻盒编号
				</td>
				<td>
					血清位置
				</td>
				<td>
					血清快递状态
				</td>
				<td>
					血浆冷冻盒编号
				</td>
				<td>
					血浆位置
				</td>
				<td>
					血浆快递状态
				</td>
				<td>
					白细胞冷冻盒编号
				</td>
				<td>
					白细胞位置
				</td>
				<td>
					白细胞快递状态
				</td>
				<td>
					血液样本备注
				</td>
				<td>
					唾液采样日期
				</td>
				<td>
					唾液冷冻盒编号
				</td>
				<td>
					白细胞冷冻盒编号
				</td>
				<td>
					白细胞冷冻盒编号
				</td>
				<td>
					白细胞冷冻盒编号
				</td>
			</tr>
			<tr>
				<td>
					number
				</td>

				<td>
					sid
				</td>
				<td>
					name
				</td>
				<td>
					area_deptId
				</td>

				<td>
					community_dept_id
				</td>
				<td>
					nick_name
				</td>
				<td>
					group
				</td>

				<td>
					release_date
				</td>
				<td>
					fit_code
				</td>
				<td>
					result_date
				</td>

				<td>
					result
				</td>
				<td>
					up_line_value
				</td>
				<td>
					down_line_value
				</td>

				<td>
					in_ten_min
				</td>
				<td>
					no_reson_result
				</td>
			</tr>
			<iterator property="exportResultList">
				<tr>
					<td>
						${number}
					</td>

					<td>
						${sid}
					</td>
					<td>
						${name}
					</td>
					<td>
						${areaDeptId}
					</td>

					<td>
						${communityDeptId}
					</td>
					<td>
						${nickName}
					</td>
					<td>
						${group}
					</td>

					<td>
						${releaseDate}
					</td>
					<td>
						${fitCode}
					</td>
					<td>
						${resultDate}
					</td>

					<td>
						${result}
					</td>
					<td>
						${upLineValue}
					</td>
					<td>
						${downLineValue}
					</td>

					<td>
						${inTenMin}
					</td>
					<td>
						${noResonResult}
					</td>
				</tr>
			</iterator>
		</table>
	</body>
</excel>