<?xml version="1.0" encoding="UTF-8"?>
<!DOCTYPE style-config SYSTEM "./exportConfig_1_1.dtd">
<excel>
	<body>
		<table>
			<tr>
				<td>
					序号
				</td>
				<td>
					SID
				</td>
				<td>
					姓名
				</td>
				<td>
					所属地区
				</td>
				<td>
					所属区
				</td>
				<td>
					所属社区
				</td>
				<td>
					分组方案（A：A组，B：B组，C：C组，Cd：C组低位，Cg：C组高危）
				</td>
				<td>
					发放日期
				</td>
				<td>
					FIT编码
				</td>
				<td>
					结果录入日期
				</td>
				<td>
					FIT结果（1：阴性 2：阳性 3：无效 4：无结果）
				</td>
				<td>
					上线
				</td>
				<td>
					下线
				</td>
				<td>
					是否10min内读取（ 1：是  0：否）
				</td>
				<td>
					无结果原因
				</td>
			</tr>
			<iterator property="exportResultList">
				<tr>
					<td>
						${number}
					</td>

					<td>
						${sid}
					</td>
					<td>
						${name}
					</td>
					<td>
						${areaName}
					</td>

					<td>
						${depName}
					</td>
					<td>
						${nickName}
					</td>
					<td>
						${group}
					</td>

					<td>
						${releaseDate}
					</td>
					<td>
						${fitCode}
					</td>
					<td>
						${resultDate}
					</td>

					<td>
						${result}
					</td>
					<td>
						${upLineValue}
					</td>
					<td>
						${downLineValue}
					</td>

					<td>
						${inTenMin}
					</td>
					<td>
						${noResonResult}
					</td>
				</tr>
			</iterator>
		</table>
	</body>
</excel>