<?xml version="1.0" encoding="UTF-8"?>
<!DOCTYPE style-config SYSTEM "./exportConfig_1_1.dtd">
<excel>
    <body>
        <table>
            <tr>
                <td>
                    序号
                </td>
                <td>
                    SID
                </td>
                <td>
                    姓名
                </td>
                <td>
                    所属地区
                </td>
                <td>
                    所属区
                </td>
                <td>
                    所属社区
                </td>
                <td>
                    分组方案
                </td>
                <td>
                    发放方式（1：受试者/家属到社区中心自取，2：社区工作人员入户递送，3：邻居从社区中心捎带取走，4：受试者/家属到医院自取，5：其它，请备注；）
                </td>
                <td>
                    发放日期
                </td>
                <td>
                    发放工作人员
                </td>
                <td>
                    备注
                </td>
            </tr>
<!--            <tr>
                <td>
                    id
                </td>
                <td>
                    sid
                </td>
                <td>
                    name
                </td>
                <td>
                    areaDeptId
                </td>

                <td>
                    communityDeptId
                </td>
                <td>
                    nickName
                </td>
                <td>
                    group
                </td>
                <td>
                    notification_issue_mode
                </td>
                <td>
                    notification_issue_date
                </td>
                <td>
                    notification_issue_worker_code
                </td>
                <td>
                    notification_issue_note
                </td>
            </tr>-->
            <iterator property="exportResultList">
                <tr>
                    <td>
                        ${id}
                    </td>

                    <td>
                        ${sid}
                    </td>
                    <td>
                        ${name}
                    </td>
                    <td>
                        ${areaName}
                    </td>

                    <td>
                        ${depName}
                    </td>
                    <td>
                        ${nickName}
                    </td>
                    <td>
                        ${group}
                    </td>
                    <td>
                        ${notificationIssueMode}
                    </td>
                    <td>
                        ${notificationIssueDate}
                    </td>
                    <td>
                        ${notificationIssueWorkerCode}
                    </td>
                    <td>
                        ${notificationIssueNote}
                    </td>
                </tr>
            </iterator>
        </table>
    </body>
</excel>