<?xml version="1.0" encoding="UTF-8"?>
<!DOCTYPE style-config SYSTEM "./exportConfig_1_1.dtd">
<excel>
	<body>
		<table>
			<!--<tr>-->
				<!--<td>-->
					<!--SID-->
				<!--</td>-->
				<!--<td>-->
					<!--姓名-->
				<!--</td>-->
				<!--<td>-->
					<!--填表日期-->
				<!--</td>-->
				<!--<td>-->
					<!--筛查现场ID-->
				<!--</td>-->
				<!--<td>-->
					<!--工作人员编码-->
				<!--</td>-->
				<!--<td>-->
					<!--检查年份-->
				<!--</td>-->
				<!--<td>-->
					<!--填表人-->
				<!--</td>-->
				<!--<td>-->
					<!--质控者-->
				<!--</td>-->
				<!--<td>-->
					<!--违规种类-筛查对象随机分配无效-->
				<!--</td>-->
				<!--<td>-->
					<!--违规种类-对筛查对象进行了一次以上的随机分配-->
				<!--</td>-->
				<!--<td>-->
					<!--多次随机分配的初始ID-->
				<!--</td>-->
				<!--<td>-->
					<!--违规种类-筛查对象在完成研究前未填写知情同意书-->
				<!--</td>-->
				<!--<td>-->
					<!--违规种类-筛查对象在筛查之前已报告或确诊患有癌症-->
				<!--</td>-->
				<!--<td>-->
					<!--违规种类-随机化分组后的对象接受了其它干预组提供的筛查-->
				<!--</td>-->
				<!--<td>-->
					<!--随机化分组后的对象接受了其它干预组提供的筛查具体说明-->
				<!--</td>-->
				<!--<td>-->
					<!--违规种类-向筛查对象报告了错误的结果-->
				<!--</td>-->
				<!--<td>-->
					<!--违规种类-进行了重复的筛查-->
				<!--</td>-->
				<!--<td>-->
					<!--违规种类-受保护的医疗信息遭泄露-->
				<!--</td>-->
				<!--<td>-->
					<!--违规种类-随机分组分配ID号后，因受试者主观原因在进行到一定程度后决意退出试验-->
				<!--</td>-->
				<!--<td>-->
					<!--受试者退出的主观原因说明-->
				<!--</td>-->
				<!--<td>-->
					<!--受试者退出时预约或完成检查的说明-->
				<!--</td>-->
				<!--<td>-->
					<!--违规种类-其他-->
				<!--</td>-->
				<!--<td>-->
					<!--其他违规种类的说明-->
				<!--</td>-->
				<!--<td>-->
					<!--违规事件发现日期-->
				<!--</td>-->
				<!--<td>-->
					<!--违规事件发生日期-->
				<!--</td>-->
				<!--<td>-->
					<!--随机分配无效原因-年龄小于50或大于74岁-->
				<!--</td>-->
				<!--<td>-->
					<!--随机分配无效原因-曾有医生告诉过患有结直肠癌-->
				<!--</td>-->
				<!--<td>-->
					<!--结直肠癌确诊日期-->
				<!--</td>-->
				<!--<td>-->
					<!--结直肠癌确诊日期为预估日期-->
				<!--</td>-->
				<!--<td>-->
					<!--随机分配无效原因-进行过结直肠癌切除手术-->
				<!--</td>-->
				<!--<td>-->
					<!--随机分配无效原因-正在接受任何癌症相关的治疗（非黑色素皮肤癌除外）-->
				<!--</td>-->
				<!--<td>-->
					<!--随机分配无效原因-在过去5年里，做过结肠镜、乙状结肠镜检查、气钡双重造影、CT仿真结肠镜等结直肠癌筛查；或者CT肠道成像等结直肠癌筛查-->
				<!--</td>-->
				<!--<td>-->
					<!--随机分配无效原因-在过去1年里，接受过粪便潜血检测或者粪便DNA检测-->
				<!--</td>-->
				<!--<td>-->
					<!--随机分配无效原因-有下列下消化道疾病提示需要结肠镜进行确认？1）过去半年中长时间的直肠出血；2）明确诊断的缺铁性贫血；3）过去6个月中有记录的不明原因的体重下降（超过10%基础体重）-->
				<!--</td>-->
				<!--<td>-->
					<!--随机分配无效原因-有其他严重疾病（包括严重的肺部疾病，晚期肾病，晚期肝病、严重的心衰、近期诊断为除黑色素皮肤癌外的其他癌症）-->
				<!--</td>-->
				<!--<td>-->
					<!--随机分配无效原因-未签署知情同意书-->
				<!--</td>-->
				<!--<td>-->
					<!--随机分配无效原因-随机分组后分配ID号后，因受试者主观原因在未接受任何筛查干预前决意退出试验-->
				<!--</td>-->
				<!--<td>-->
					<!--随机分组后分配ID号后，受试者在未接受任何筛查干预前决意退出试验的主观原因说明-->
				<!--</td>-->
				<!--<td>-->
					<!--违反方案内容的具体描述-->
				<!--</td>-->
				<!--<td>-->
					<!--当前年总体状态-->
				<!--</td>-->
			<!--</tr>-->
			<tr>
				<td>
					ssz_id
				</td>
				<td>
					mz
				</td>
				<td>
					tbrq
				</td>
				<td>
					scxc_id
				</td>
				<td>
					i_code
				</td>
				<td>
					c_year
				</td>
				<td>
					tbr
				</td>
				<td>
					zkzr
				</td>
				<td>
					it_1a_1
				</td>
				<td>
					it_1a_2
				</td>
				<td>
					it_1a_2_id
				</td>
				<td>
					it_1a_3
				</td>
				<td>
					it_1a_4
				</td>
				<td>
					it_1a_5
				</td>
				<td>
					it_1a_5_des
				</td>
				<td>
					it_1a_6
				</td>
				<td>
					it_1a_7
				</td>
				<td>
					it_1a_8
				</td>
				<td>
					it_1a_9
				</td>
				<td>
					it_1a_9_cause
				</td>
				<td>
					it_1a_9_des
				</td>
				<td>
					it_1a_10
				</td>
				<td>
					it_1a_10_other
				</td>
				<td>
					it2a1
				</td>
				<td>
					it2b1
				</td>
				<td>
					it_3a_1
				</td>
				<td>
					it_3a_2
				</td>
				<td>
					it_3a_2_time
				</td>
				<td>
					it_3a_2_estimate
				</td>
				<td>
					it_3a_3
				</td>
				<td>
					it_3a_4
				</td>
				<td>
					it_3a_5
				</td>
				<td>
					it_3a_6
				</td>
				<td>
					it_3a_7
				</td>
				<td>
					it_3a_8
				</td>
				<td>
					it_3a_9
				</td>
				<td>
					it_3a_10
				</td>
				<td>
					it_3a_10_cause
				</td>
				<td>
					it_4a_1
				</td>
				<td>
					o_s_c
				</td>
			</tr>
<!--			<tr>
				<td>
					sid
				</td>
				<td>
					name
				</td>
				<td>
					tb_date
				</td>
				<td>
					siteId
				</td>
				<td>
					investigator_code
				</td>
				<td>
					check_year
				</td>
				<td>
					tbr_name
				</td>
				<td>
					zkz_name
				</td>
				<td>
					item_1a_1
				</td>
				<td>
					item_1a_2
				</td>
				<td>
					item_1a_2_id
				</td>
				<td>
					item_1a_3
				</td>
				<td>
					item_1a_4
				</td>
				<td>
					item_1a_5
				</td>
				<td>
					item_1a_5_des
				</td>
				<td>
					item_1a_6
				</td>
				<td>
					item_1a_7
				</td>
				<td>
					item_1a_8
				</td>
				<td>
					item_1a_9
				</td>
				<td>
					item_1a_9_cause
				</td>
				<td>
					item_1a_9_des
				</td>
				<td>
					item_1a_10
				</td>
				<td>
					item_1a_10_other
				</td>
				<td>
					item2a1
				</td>
				<td>
					item2b1
				</td>
				<td>
					item_3a_1
				</td>
				<td>
					item_3a_2
				</td>
				<td>
					item_3a_2_time
				</td>
				<td>
					item_3a_2_estimate
				</td>
				<td>
					item_3a_3
				</td>
				<td>
					item_3a_4
				</td>
				<td>
					item_3a_5
				</td>
				<td>
					item_3a_6
				</td>
				<td>
					item_3a_7
				</td>
				<td>
					item_3a_8
				</td>
				<td>
					item_3a_9
				</td>
				<td>
					item_3a_10
				</td>
				<td>
					item_3a_10_cause
				</td>
				<td>
					item_4a_1
				</td>
				<td>
					overall_status_cy
				</td>
			</tr>-->
			<iterator property="exportResultList">
				<tr>
					<td>
						${sid}
					</td>
					<td>
						${name}
					</td>

					<td>
						${tbDateS}
					</td>
					<td>
						${siteId}
					</td>
					<td>
						${investigatorCode}
					</td>
					<td>
						${checkYear}
					</td>
					<td>
						${tbrName}
					</td>
					<td>
						${zkzName}
					</td>
					<td>
						${item_1a_1}
					</td>
					<td>
						${item_1a_2}
					</td>
					<td>
						${item_1a_2_id}
					</td>
					<td>
						${item_1a_3}
					</td>
					<td>
						${item_1a_4}
					</td>
					<td>
						${item_1a_5}
					</td>
					<td>
						${item_1a_5_des}
					</td>
					<td>
						${item_1a_6}
					</td>
					<td>
						${item_1a_7}
					</td>
					<td>
						${item_1a_8}
					</td>
					<td>
						${item_1a_9}
					</td>
					<td>
						${item_1a_9_cause}
					</td>
					<td>
						${item_1a_9_des}
					</td>
					<td>
						${item_1a_10}
					</td>
					<td>
						${item_1a_10_other}
					</td>
					<td>
						${item2a1}
					</td>
					<td>
						${item2b1}
					</td>
					<td>
						${item_3a_1}
					</td>
					<td>
						${item_3a_2}
					</td>
					<td>
						${item3a2Time}
					</td>
					<td>
						${item_3a_2_estimate}
					</td>
					<td>
						${item_3a_3}
					</td>
					<td>
						${item_3a_4}
					</td>
					<td>
						${item_3a_5}
					</td>
					<td>
						${item_3a_6}
					</td>
					<td>
						${item_3a_7}
					</td>
					<td>
						${item_3a_8}
					</td>
					<td>
						${item_3a_9}
					</td>
					<td>
						${item_3a_10}
					</td>
					<td>
						${item_3a_10_cause}
					</td>
					<td>
						${item_4a_1}
					</td>
					<td>
						${overallStatusCy}
					</td>
				</tr>
			</iterator>
		</table>
	</body>
</excel>