<?xml version="1.0" encoding="UTF-8"?>
<!DOCTYPE style-config SYSTEM "./exportConfig_1_1.dtd">
<excel>
	<body>
		<table>
			<!--<tr>-->
<!--&lt;!&ndash;				<td>-->
					<!--序号-->
				<!--</td>&ndash;&gt;-->
				<!--<td>-->
					<!--SID-->
				<!--</td>-->
				<!--<td>-->
					<!--分组-->
				<!--</td>-->
				<!--<td>-->
					<!--姓名-->
				<!--</td>-->
				<!--<td>-->
					<!--身份证号-->
				<!--</td>-->
				<!--<td>-->
					<!--性别-->
				<!--</td>-->
				<!--<td>-->
					<!--出生日期-->
				<!--</td>-->
				<!--<td>-->
					<!--家庭住址-->
				<!--</td>-->
				<!--<td>-->
					<!--联系电话-->
				<!--</td>-->
				<!--<td>-->
					<!--筛查现场ID-->
				<!--</td>-->
				<!--<td>-->
					<!--资格审核日期-->
				<!--</td>-->
				<!--<td>-->
					<!--调查员-->
				<!--</td>-->
				<!--<td>-->
					<!--审核员-->
				<!--</td>-->
				<!--<td>-->
					<!--实足年龄-->
				<!--</td>-->
				<!--<td>-->
					<!--是否曾有医生告诉过您患有结直肠癌-->
				<!--</td>-->
				<!--<td>-->
					<!--是否进行过结肠切除手术-->
				<!--</td>-->
				<!--<td>-->
					<!--是否正在接受任何癌症相关的治疗（非黑色素皮肤癌除外）-->
				<!--</td>-->
				<!--<td>-->
					<!--过去5年中是否有过结肠镜、纤维乙状结肠镜、气钡双对比造影、CT仿真结肠镜检查-->
				<!--</td>-->
				<!--<td>-->
					<!--近1年内是否接受过粪便潜血检测（FOBT）或者粪便DNA检测？-->
				<!--</td>-->
				<!--<td>-->
					<!--是否有下列下消化道疾病或症状提示需要结肠镜进行确诊？1）过去半年中长时间的大便带血；2）明确诊断的缺铁性贫血；3）过去6个月中有记录的不明原因的体重下降（超过10%基础体重）？-->
				<!--</td>-->
				<!--<td>-->
					<!--是否有其他严重疾病（包括严重的肺部疾病，晚期肾病，晚期肝病、严重的心衰、近期诊断为除黑色素皮肤癌外的其他癌症）？-->
				<!--</td>-->
				<!--<td>-->
					<!--非本市户籍常驻人口，且本地居住不足3年？-->
				<!--</td>-->
				<!--<td>-->
					<!--他/她是否不愿意或者不能自己签署知情同意书？-->
				<!--</td>-->
				<!--<td>-->
					<!--当前年总体状态-->
				<!--</td>-->
			<!--</tr>-->
			<tr>
<!--				<td>
					xh
				</td>-->
				<td>
					ssz_id
				</td>
				<td>
					fz
				</td>
				<td>
					xm
				</td>
				<td>
					sfz
				</td>
				<td>
					xb
				</td>
				<td>
					cs_date
				</td>
				<td>
					jtzzp
				</td>
				<td>
					jtzzc
				</td>
				<td>
					jtzza
				</td>
				<td>
					jtzzz
				</td>
				<td>
					jtzzzx
				</td>
				<td>
					jtzz
				</td>
				<td>
					lxdh
				</td>
				<td>
					scxc_id
				</td>
				<td>
					zgsc_date
				</td>
				<td>
					dcy
				</td>
				<td>
					shy
				</td>
				<td>
					it_1
				</td>
				<td>
					it_2
				</td>
				<td>
					it_3
				</td>
				<td>
					it_4
				</td>
				<td>
					it_5
				</td>
				<td>
					it_6
				</td>
				<td>
					it_7
				</td>
				<td>
					it_8
				</td>
				<td>
					it_9
				</td>
				<td>
					it_10
				</td>
				<td>
					o_s_c
				</td>
			</tr>
<!--			<tr>
				<td>
					number
				</td>

				<td>
					sid
				</td>
				<td>
					group
				</td>
				<td>
					name
				</td>
				<td>
					id_card
				</td>
				<td>
					sex
				</td>
				<td>
					birth_date
				</td>

				<td>
					address
				</td>
				<td>
					phone
				</td>
				<td>
					site_id
				</td>

				<td>
					survey_date
				</td>
				<td>
					investigator
				</td>
				<td>
					reviewer
				</td>

				<td>
					item1
				</td>
				<td>
					item2
				</td>
				<td>
					item3
				</td>
				<td>
					item4
				</td>
				<td>
					item5
				</td>
				<td>
					item6
				</td>
				<td>
					item7
				</td>
				<td>
					item8
				</td>
				<td>
					item9
				</td>
				<td>
					item10
				</td>
				<td>
					overall_status_cy
				</td>
			</tr>-->
			<iterator property="exportResultList">
				<tr>
<!--					<td>
						${number}
					</td>-->

					<td>
						${sid}
					</td>
					<td>
						${group}
					</td>
					<td>
						${name}
					</td>
					<td>
						${idCard}
					</td>
					<td>
						${sex}
					</td>
					<td>
						${birthDateToString}
					</td>
					<td>
						${province}
					</td>
					<td>
						${city}
					</td>
					<td>
						${area}
					</td>
					<td>
						${township}
					</td>
					<td>
						${village}
					</td>
					<td>
						${cityOther}
					</td>
					<td>
						${phone}
					</td>
					<td>
						${siteId}
					</td>

					<td>
						${surveyDateToString}
					</td>
					<td>
						${investigator}
					</td>
					<td>
						${reviewer}
					</td>

					<td>
						${item1}
					</td>
					<td>
						${item2}
					</td>
					<td>
						${item3}
					</td>
					<td>
						${item4}
					</td>
					<td>
						${item5}
					</td>
					<td>
						${item6}
					</td>
					<td>
						${item7}
					</td>
					<td>
						${item8}
					</td>
					<td>
						${item9}
					</td>
					<td>
						${item10}
					</td>
					<td>
						${overallStatusCy}
					</td>
				</tr>
			</iterator>
		</table>
	</body>
</excel>